{
  "$schema": "https://json-schema.org/draft/2020-12/schema",
  "$id": "https://example.com/schemas/telematics_event.schema.json",
  "title": "Telematics Event",
  "type": "object",
  "required": ["event_id", "vehicle_id", "ts", "lat", "lon"],
  "additionalProperties": false,
  "properties": {
    "schema_version": { "type": "string", "const": "1.0.0" },
    "event_id": { "type": "string", "format": "uuid" },
    "vehicle_id": { "type": "string", "minLength": 1 },
    "driver_id": { "type": "string", "minLength": 1 },
    "ts": { "type": "string", "format": "date-time" },
    "lat": { "type": "number", "minimum": -90, "maximum": 90 },
    "lon": { "type": "number", "minimum": -180, "maximum": 180 },
    "speed_kph": { "type": "number", "minimum": 0, "maximum": 300 },
    "heading_deg": { "type": "number", "minimum": 0, "maximum": 360 },
    "accel_ms2": { "type": "number", "minimum": -20, "maximum": 20 },
    "fuel_pct": { "type": "number", "minimum": 0, "maximum": 100 },
    "odometer_km": { "type": "number", "minimum": 0 },
    "meta": {
      "type": "object",
      "additionalProperties": false,
      "properties": {
        "route_id": { "type": "string" },
        "source": { "type": "string", "enum": ["simulator","device","replay"] }
      }
    }
  }
}